source_ip,url,method,classification,risk_level,patterns,recommendation,timestamp
"192.168.1.10","/index.html","GET","None","Low","No suspicious patterns detected in the request.","Monitor for future anomalies.","2026-02-27T08:01:12+00:00"
"192.168.1.10","/style.css","GET","None","Low","No suspicious patterns detected in the request.","Monitor for unusual activity.","2026-02-27T08:01:15+00:00"
"10.0.0.55","/admin/config.php","GET","Command Injection","Critical","User-Agent header contains 'sqlmap' which is commonly used for SQL injection testing tools.","Immediately block the IP address and conduct a thorough security audit of your web application.","2026-02-27T08:02:01+00:00"
"10.0.0.55","/admin/config.php?id=1'","GET","SQL Injection","Critical","Payload 'id=1' appended to query string, potential SQL injection point.","Immediate investigation and sanitization of input fields. Implement prepared statements or stored procedures.","2026-02-27T08:02:03+00:00"
"10.0.0.55","/admin/config.php?id=1","GET","Command Injection","Critical","The URL parameter 'id' is used in a context where it could be exploited to execute arbitrary commands on the server.","Immediately restrict access by removing or securing this endpoint, and review all input validation mechanisms.","2026-02-27T08:02:05+00:00"
"172.16.0.200","/login","POST","Suspicious","Medium","User Agent string does not match common browsers, potential forged requests from untrusted IP address.","Implement User-Agent validation and geolocation checks to mitigate risk.","2026-02-27T08:03:44+00:00"
"172.16.0.200","/login","POST","Suspicious","Medium","User Agent string does not match common browsers, POST method used for login may indicate potential risk.","Implement rate limiting and user agent whitelisting. Investigate the source IP address.","2026-02-27T08:03:45+00:00"
"172.16.0.200","/login","POST","None","Low","No immediate suspicious patterns detected.","Monitor for unusual activity and consider implementing rate limiting.","2026-02-27T08:03:46+00:00"
"172.16.0.200","/login","POST","SQL Injection","High","Possible SQL injection attempt detected in the username and password fields.","Immediately sanitize input data, implement prepared statements or stored procedures to prevent further attempts.","2026-02-27T08:03:47+00:00"
"172.16.0.200","/login","POST","None","Low","No suspicious patterns detected in the provided data.","Monitor for any unusual activity.","2026-02-27T08:03:48+00:00"
"45.33.32.156","/../../../etc/passwd","GET","Path Traversal","Critical","/../../../etc/passwd is a classic example of path traversal, attempting to access sensitive files outside the web root directory.","Implement strict input validation and use allowlists for file paths.","2026-02-27T08:05:00+00:00"
"45.33.32.156","/wp-login.php","GET","Suspicious","Medium","Attempt to access a sensitive file through an uncommon path.","Implement strict input validation and sanitization, restrict directory browsing.","2026-02-27T08:05:01+00:00"
"45.33.32.156","/.env","GET","Path Traversal","Medium","Attempt to access files outside of the web root directory.","Implement strict input validation and set a safe base path.","2026-02-27T08:05:02+00:00"
"45.33.32.156","/phpmyadmin/index.php","GET","SQL Injection","Critical","The URL contains 'phpmyadmin', which is commonly associated with MySQL databases, and the request method is GET without any query parameters that could mitigate SQL injection risks.","Immediately restrict access to this endpoint using firewall rules or IP whitelisting. Conduct a thorough security audit of database configurations.","2026-02-27T08:05:03+00:00"
"192.168.1.20","/products","GET","None","Low","No suspicious patterns detected in the request data provided.","Continue monitoring and regularly updating security protocols.","2026-02-27T08:10:00+00:00"
"192.168.1.20","/products/item?id=42","GET","None","Low","No suspicious patterns detected in the URL, method or user agent.","Maintain current security measures.","2026-02-27T08:10:05+00:00"
"192.168.1.20","/cart/add","POST","None","Low","No suspicious patterns detected in the provided data.","Maintain regular monitoring and implement a web application firewall for enhanced security.","2026-02-27T08:10:10+00:00"
"198.51.100.7","/<script>alert(1)</script>","GET","XSS","High","Script tags within the URL path, potentially leading to cross-site scripting attacks.","Implement strict input validation and output encoding. Use a WAF or similar security measures.","2026-02-27T08:15:00+00:00"
"198.51.100.7","/?q=<img","GET","SQL Injection","Critical","<img src=x onerror=alert(1)>","Immediately sanitize input fields and implement prepared statements to prevent SQL injection attacks.","2026-02-27T08:15:01+00:00"
"198.51.100.7","/search?q=%3Cscript%3Ealert%28document.cookie%29%3C%2Fscript%3E","GET","XSS","High","<script>alert(document.cookie)</script>","Implement input validation and output encoding to prevent script injection.","2026-02-27T08:15:02+00:00"
"10.10.10.5","/api/users","GET","None","Low","No suspicious patterns detected in the provided HTTP request data.","Continue monitoring and regularly reviewing security protocols.","2026-02-27T09:00:01+00:00"
"10.10.10.5","/api/users?id=1","GET","None","Low","No suspicious patterns detected.","Continue monitoring for unusual activity.","2026-02-27T09:00:02+00:00"
"203.0.113.42","/api/users?id=1;","GET","SQL Injection","High","The URL parameter 'id' is potentially used in a SQL query without proper sanitization.","Implement prepared statements or use an ORM to handle database queries, and validate all input parameters.","2026-02-27T09:01:00+00:00"
"203.0.113.42","/api/data?file=../../../../etc/shadow","GET","Path Traversal","Critical","The URL parameter 'file' contains a path traversal sequence that attempts to access sensitive files outside the intended directory.","Implement strict input validation and sanitization, use allowlists for acceptable paths.","2026-02-27T09:01:01+00:00"
"203.0.113.42","/api/data?file=..%2F..%2F..%2Fetc%2Fpasswd","GET","Path Traversal","High","The URL parameter 'file' contains a path traversal sequence that attempts to access the system'th passwd file.","Implement strict input validation and sanitization, use allowlists for directory access.","2026-02-27T09:01:02+00:00"
"10.10.10.5","/api/upload","POST","None","Low","User agent not indicative of a threat, but further analysis is recommended.","Implement rate limiting and input validation for the upload endpoint.","2026-02-27T09:05:00+00:00"
"185.220.101.1","/robots.txt","GET","Normal","None","No suspicious patterns detected.","No immediate action required.","2026-02-27T09:10:00+00:00"
"185.220.101.1","/sitemap.xml","GET","Normal","None","No suspicious patterns detected.","Monitor regularly.","2026-02-27T09:10:01+00:00"